{
  "$schema": "../../packages/content-schema/presentation-metadata.schema.json",
  "schemaVersion": 2,
  "kind": "presentation",
  "slug": "state-management",
  "title": "Gerenciamento de estado",
  "description": "Uma apresentação histórica sobre estratégias e ferramentas para gerenciamento de estado.",
  "format": "talk",
  "language": "pt-BR",
  "topics": ["frontend", "estado", "javascript"],
  "level": "all-levels",
  "deliveredAt": { "year": 2020, "month": 1, "approximate": true },
  "status": "published",
  "sourceUrl": "https://github.com/DavidDimon/state-management-keynote",
  "historicalNotice": "Este conteúdo reflete o estado da tecnologia na época em que foi produzido.",
  "migrationStatus": "migrated"
}
